{"config_sha256":"68cc61753d299917cc7773f069c18aca31c8ac68f43736a94cb57eee05144084","fingerprint":"sha256:4a76bf4640f34e094753799173e2a94e5114a1cf5e447b0dcaa6fea04a6a6d29","parser":{"name":"ethos","version":"0.3.0"},"payload":{"chunks":[],"coordinate_system":{"origin":"top-left","quantum_per_point":100,"unit":"quantum"},"elements":[{"bbox":[7200,7200,54000,8600],"id":"e000001","page":"p0001","span_refs":["s000001"],"text":"Ethos record 06 requires deterministic citation evidence.","type":"text_block"},{"bbox":[7200,10000,26000,11400],"id":"e000002","page":"p0001","span_refs":["s000002"],"text":"Split record 06 joins ","type":"text_block"},{"bbox":[26000,10000,54000,11400],"id":"e000003","page":"p0001","span_refs":["s000003"],"text":"adjacent born-digital text.","type":"text_block"},{"bbox":[7200,7200,54000,8600],"id":"e000004","page":"p0002","span_refs":["s000004"],"text":"Secondary value 06 is independently citable.","type":"text_block"}],"pages":[{"height":79200,"id":"p0001","index":1,"rotation":0,"width":61200},{"height":79200,"id":"p0002","index":2,"rotation":0,"width":61200}],"parser_warnings":[],"regions":[],"security_warnings":[],"spans":[{"bbox":[7200,7200,54000,8600],"char_end":57,"char_start":0,"font_id":"embedded:Helvetica","font_size_q":1200,"id":"s000001","page":"p0001","text":"Ethos record 06 requires deterministic citation evidence."},{"bbox":[7200,10000,26000,11400],"char_end":22,"char_start":0,"font_id":"embedded:Helvetica","font_size_q":1200,"id":"s000002","page":"p0001","text":"Split record 06 joins "},{"bbox":[26000,10000,54000,11400],"char_end":27,"char_start":0,"font_id":"embedded:Helvetica","font_size_q":1200,"id":"s000003","page":"p0001","text":"adjacent born-digital text."},{"bbox":[7200,7200,54000,8600],"char_end":44,"char_start":0,"font_id":"embedded:Helvetica","font_size_q":1200,"id":"s000004","page":"p0002","text":"Secondary value 06 is independently citable."}],"tables":[]},"payload_sha256":"150953569005ca1f1d9950e9bee3c21358cc4f57d0888876d0383cf1f00d05f1","profile":{"id":"ethos-deterministic-v1","sha256":"d6145b9210845db39ad592ea549788432b52a649778c9947f5b2d91173e38070"},"schema_version":"1.0.0","source":{"bytes":1043,"fingerprint":"sha256:21356d17744b05609b8f19a7ad4638fa4a38827174a3b273b873480c45800144"}}
